<?xml version="1.0" encoding="UTF-8"?>
<ProofSpecification xmlns="http://www.zurich.ibm.com/security/idemix"
	xmlns:xsi="http://www.w3.org/2001/XMLSchema-instance"
	xsi:schemaLocation="http://www.zurich.ibm.com/security/idemix ../xsd/ProofSpecification.xsd">

	<Declaration>
		<AttributeId name="id1" proofMode="revealed" type="int" />
		<AttributeId name="id2" proofMode="unrevealed" type="int" />
		<AttributeId name="id3" proofMode="unrevealed" type="int" />
		<AttributeId name="id4" proofMode="unrevealed" type="int" />
	</Declaration>

	<Specification>
		<Credentials>
			<Credential issuerPublicKey="http://www.issuer.com/ipk.xml"
				credStruct="http://www.ngo.org/CredStruct1b.xml" name="someRandomName">
				<Attribute name="attr1">id1</Attribute>
				<Attribute name="attr2">id2</Attribute>
				<Attribute name="attr3">id4</Attribute>
				<Attribute name="attr4">id3</Attribute>
			</Credential>
		</Credentials>

		<EnumAttributes />

		<Inequalities />

		<Commitments />

		<Representations />

		<Pseudonyms />

		<VerifiableEncryptions />

		<Messages />
    
        <Accumulators>
          <Accumulator name="acc" publicKey="idemix://acc/pk" epoch="1">id3</Accumulator>
        </Accumulators>

	</Specification>

</ProofSpecification>