<?xml version="1.0" encoding="UTF-8"?>
<ProofSpecification xmlns="http://www.zurich.ibm.com/security/idemix"
	xmlns:xsi="http://www.w3.org/2001/XMLSchema-instance"
	xsi:schemaLocation="http://www.zurich.ibm.com/security/idemix ../xsd/ProofSpecification.xsd"
  >

	<Declaration/>

	<Specification>
		<Credentials/>

		<EnumAttributes />

		<Inequalities />

		<Commitments />

		<Representations />

		<Pseudonyms groupParameters="http://www.zurich.ibm.com/security/idmx/v2/gp.xml">
			<DomainPseudonym name="employeeCorner" scope="http://www.zurich.ibm.com/employeeCorner" secretName="blibli" />
		</Pseudonyms>

		<VerifiableEncryptions />

		<Messages />

	</Specification>

</ProofSpecification>