<?xml version="1.0" encoding="UTF-8"?>
<ProofSpecification xmlns="http://www.zurich.ibm.com/security/idemix"
	xmlns:xsi="http://www.w3.org/2001/XMLSchema-instance"
	xsi:schemaLocation="http://www.zurich.ibm.com/security/idemix ../xsd/ProofSpecification.xsd">

	<Declaration>
		<AttributeId name="id1" proofMode="unrevealed" type="int" />
		<AttributeId name="id2" proofMode="unrevealed" type="int" />
		<AttributeId name="id3" proofMode="revealed" type="int" />
		<AttributeId name="id4" proofMode="revealed" type="int" />
		<AttributeId name="id5" proofMode="unrevealed" type="int" />
		<AttributeId name="id6" proofMode="unrevealed" type="int" />
	</Declaration>

	<Specification>
		<Credentials>
			<Credential issuerPublicKey="http://www.issuer.com/ipk.xml"
				credStruct="http://www.ngo.org/CredStruct2.xml" name="someRandomNameMatchingTheOneInTheProofSpec">
				<Attribute name="attr1">id4</Attribute>
				<Attribute name="attr2">id3</Attribute>
				<Attribute name="attr3">id2</Attribute>
				<Attribute name="attr4">id1</Attribute>
				<Attribute name="attr5">id5</Attribute>
				<Attribute name="attr6">id6</Attribute>
			</Credential>
			<Credential issuerPublicKey="http://www.issuer.com/ipk.xml"
				credStruct="http://www.ngo.org/CredStruct3.xml" name="someRandomNameMatchingTheOneInTheProofSpec">
				<Attribute name="attr1">id2</Attribute>
				<Attribute name="attr2">id5</Attribute>
				<Attribute name="attr3">id1</Attribute>
			</Credential>
		</Credentials>

		<EnumAttributes />

		<Inequalities>
			<Inequality
				publicKey="http://www.issuer.com/ipk.xml"
				operator="geq" secondArgument="1313">id1</Inequality>
			<Inequality
				publicKey="http://www.issuer.com/ipk.xml"
				operator="lt" secondArgument="1316">id1</Inequality>
			<Inequality
				publicKey="http://www.issuer.com/ipk.xml"
				operator="lt" secondArgument="23949832742">id2</Inequality>
			<Inequality
				publicKey="http://www.issuer.com/ipk.xml"
				operator="gt" secondArgument="-328428374921315">id2</Inequality>
			<Inequality
				publicKey="http://www.issuer.com/ipk.xml"
				operator="lt" secondArgument="8293">id2</Inequality>
			<Inequality
				publicKey="http://www.issuer.com/ipk.xml"
				operator="gt" secondArgument="29">id2</Inequality>
			<Inequality
				publicKey="http://www.issuer.com/ipk.xml"
				operator="lt" secondArgument="92803492834023804238">id5</Inequality>
			<Inequality
				publicKey="http://www.issuer.com/ipk.xml"
				operator="leq" secondArgument="1317">id5</Inequality>
			<Inequality
				publicKey="http://www.issuer.com/ipk.xml"
				operator="geq" secondArgument="1317">id5</Inequality>
			<Inequality
				publicKey="http://www.issuer.com/ipk.xml"
				operator="geq" secondArgument="id4">id5</Inequality>
			<Inequality
				publicKey="http://www.issuer.com/ipk.xml"
				operator="lt" secondArgument="id3">id2</Inequality>
            <NotEqual secondArgument="1313">id2</NotEqual>
            <NotEqual secondArgument="1315">id2</NotEqual>
            <NotEqual secondArgument="0">id2</NotEqual>
            <NotEqual secondArgument="999999999999999999999999999999999999999999999">id2</NotEqual>
            <NotEqual secondArgument="id4">id2</NotEqual>
            <NotEqual secondArgument="id3">id4</NotEqual>
            <NotEqual secondArgument="42">id4</NotEqual>
		</Inequalities>

		<Commitments />

		<Representations />

		<Pseudonyms />

		<VerifiableEncryptions />

		<Messages />

	</Specification>

</ProofSpecification>