<?xml version="1.0" encoding="UTF-8"?>
<ProofSpecification xmlns="http://www.zurich.ibm.com/security/idemix"
	xmlns:xsi="http://www.w3.org/2001/XMLSchema-instance"
	xsi:schemaLocation="http://www.zurich.ibm.com/security/idemix ../xsd/ProofSpecification.xsd">

	<Declaration>
	</Declaration>

	<Specification>
		<Credentials />
    
        <CredentialCommitments>
          <CredentialCommitment issuerPublicKey="http://www.issuer.com/ipk.xml"
                  credStruct="http://www.ngo.org/CredStructWithSmartcardNoUser.xml"
                  name="toBeIssued"
                  secretName="nameOfSecret">
          </CredentialCommitment>
        </CredentialCommitments>

		<EnumAttributes />

		<Inequalities />

		<Commitments />

		<Representations />

		<Pseudonyms />

		<VerifiableEncryptions />

		<Messages />

	</Specification>

</ProofSpecification>