<?xml version="1.0" encoding="UTF-8"?>
<ProofSpecification xmlns="http://www.zurich.ibm.com/security/idemix"
	xmlns:xsi="http://www.w3.org/2001/XMLSchema-instance"
	xsi:schemaLocation="http://www.zurich.ibm.com/security/idemix ../xsd/ProofSpecification.xsd">

	<Declaration>
		<AttributeId name="id1" proofMode="revealed" type="int" />
		<AttributeId name="id2" proofMode="unrevealed" type="string" />
		<AttributeId name="id3" proofMode="unrevealed" type="int" />
		<AttributeId name="id4" proofMode="unrevealed" type="epoch" />
	</Declaration>

	<Specification>
		<Credentials>
			<Credential issuerPublicKey="http://www.issuer.com/ipk.xml"
				credStruct="http://www.ngo.org/CredStruct1d.xml"
				name="someRandomName"
				>
				<Attribute name="attr1">id1</Attribute>
				<Attribute name="attr2">id2</Attribute>
				<Attribute name="attr3">id3</Attribute>
				<Attribute name="attr4">id4</Attribute>
			</Credential>
		</Credentials>

		<EnumAttributes />

		<Inequalities>
			<Inequality
				publicKey="http://www.issuer.com/ipk.xml"
				operator="geq" secondArgument="CURRENT_EPOCH">id4</Inequality>
		</Inequalities>

		<Commitments />

		<Representations />

		<Pseudonyms />

		<VerifiableEncryptions />

		<Messages />

	</Specification>

</ProofSpecification>