<?xml version="1.0" encoding="UTF-8"?>
<ProofSpecification xmlns="http://www.zurich.ibm.com/security/idemix"
	xmlns:xsi="http://www.w3.org/2001/XMLSchema-instance"
	xsi:schemaLocation="http://www.zurich.ibm.com/security/idemix ../xsd/ProofSpecification.xsd">

	<Declaration>
		<AttributeId name="id1" proofMode="revealed" type="string" />
		<AttributeId name="id2" proofMode="unrevealed" type="string" />
		<AttributeId name="id3" proofMode="unrevealed" type="enum" />
		<AttributeId name="id4" proofMode="unrevealed" type="enum" />
		<AttributeId name="id5" proofMode="unrevealed" type="int" />
		<AttributeId name="id6" proofMode="unrevealed" type="int" />
		<AttributeId name="id7" proofMode="unrevealed" type="epoch" />
		<AttributeId name="id8" proofMode="unrevealed" type="string" />
	</Declaration>

	<Specification>
		<Credentials>
			<Credential issuerPublicKey="http://www.ch.ch/identityCard/v2012/ipk.xml"
				credStruct="http://www.ch.ch/identityCard/v2012/CredStructComplete.xml"
				name="kdsfjk230fsefj329">
				<Attribute name="FirstName">id1</Attribute>
				<Attribute name="LastName">id2</Attribute>
				<Attribute name="PrimeEncoding1">id3</Attribute>
				<Attribute name="PrimeEncoding2">id4</Attribute>
				<Attribute name="SocialSecurityNumber">id5</Attribute>
				<Attribute name="Diet">id8</Attribute>
				<Attribute name="Epoch">id7</Attribute>
				<Attribute name="BirthDate">id6</Attribute>
			</Credential>
		</Credentials>

		<EnumAttributes>
			<EnumAttribute attributeId="id3" operator="and">
				<EnumValue attributeName="OfficialLanguage">German</EnumValue>
			</EnumAttribute>
			<EnumAttribute attributeId="id3" operator="not">
				<EnumValue attributeName="OfficialLanguage">Rhaeto-Romanic</EnumValue>
				<EnumValue attributeName="OfficialLanguage">Italian</EnumValue>
			</EnumAttribute>
			<EnumAttribute attributeId="id3" operator="not">
				<EnumValue attributeName="CivilStatus">NeverMarried</EnumValue>
				<EnumValue attributeName="CivilStatus">Widowed</EnumValue>
				<EnumValue attributeName="CivilStatus">Divorced</EnumValue>
			</EnumAttribute>
			<EnumAttribute attributeId="id4" operator="and">
				<EnumValue attributeName="DriverCategory">F</EnumValue>
				<EnumValue attributeName="DriverCategory">G</EnumValue>
				<EnumValue attributeName="DriverCategory">M</EnumValue>
			</EnumAttribute>
		</EnumAttributes>

		<Inequalities>
			<Inequality publicKey="http://www.ch.ch/identityCard/v2012/ipk.xml"
				operator="geq" secondArgument="1313">id5</Inequality>
			<Inequality publicKey="http://www.ch.ch/identityCard/v2012/ipk.xml"
				operator="lt" secondArgument="1320">id5</Inequality>
			<Inequality publicKey="http://www.ch.ch/identityCard/v2012/ipk.xml"
				operator="lt" secondArgument="23949832742">id5</Inequality>
			<Inequality publicKey="http://www.ch.ch/identityCard/v2012/ipk.xml"
				operator="gt" secondArgument="-328428374921315">id5</Inequality>
			<Inequality publicKey="http://www.ch.ch/identityCard/v2012/ipk.xml"
				operator="leq" secondArgument="CURRENT_EPOCH">id7</Inequality>
		</Inequalities>

		<Commitments>
			<Commitment name="j39rfj3rf903jfsga">
				<Exponent index="0">id1</Exponent>
				<Exponent index="1">id2</Exponent>
			</Commitment>
			<Commitment name="29saoxcznbfjsapqw">
				<Exponent index="0">id5</Exponent>
			</Commitment>
		</Commitments>


		<Representations>

		</Representations>


		<Pseudonyms />

		<VerifiableEncryptions>
			<VerifiableEncryption name="jd2e0asfdkkj3rqq1"
				publicKey="http://www.zurich.ibm.com/security/idmx/v2/testTrustedParty/vepk.xml"
				label="TestLabel">id5
			</VerifiableEncryption>
			<VerifiableEncryption name="39asxz0x09dfsdka2"
				publicKey="http://www.zurich.ibm.com/security/idmx/v2/testTrustedParty/vepk.xml"
				label="TestLabel">id2
			</VerifiableEncryption>
		</VerifiableEncryptions>

		<Messages>
			<Message name="d0fsdfkii2fucxzkl">Some message that is going to be included into
				the Hash.</Message>
		</Messages>

	</Specification>

</ProofSpecification>